{
  "schema_version": 1,
  "synthetic": true,
  "github": {"account": "example-owner", "repository": "example-harness", "visibility": "private"},
  "nodes": [
    {"name": "hermes-k3s-01", "address": "192.0.2.11", "ssh_user": "engineer", "ssh_port": 22, "identity_file": "/protected/key", "known_hosts_file": "/protected/known_hosts"},
    {"name": "hermes-k3s-02", "address": "192.0.2.12", "ssh_user": "engineer", "ssh_port": 22, "identity_file": "/protected/key", "known_hosts_file": "/protected/known_hosts"},
    {"name": "hermes-k3s-03", "address": "192.0.2.13", "ssh_user": "engineer", "ssh_port": 22, "identity_file": "/protected/key", "known_hosts_file": "/protected/known_hosts"}
  ],
  "network": {
    "api_endpoint": "api.example.invalid", "public_hostname": "hermes.example.invalid",
    "pod_cidr": "10.42.0.0/16", "service_cidr": "10.43.0.0/16",
    "existing_cidrs": ["192.0.2.0/24"], "existing_cidrs_reviewed": false
  },
  "storage": {"storage_class": "hermes-vsphere", "policy_ref": "synthetic-policy"},
  "gates": {"vmware_compatibility": "pending", "api_failover": "pending", "network_review": "pending", "cpi_design": "pending"}
}
